<?xml version="1.0" encoding="utf-8"?>
<!-- Created with Liquid Technologies Online Tools 1.0 (https://www.liquid-technologies.com) -->
<!--<Shell xmlns="http://www.severtrans.com" 
    xmlns:jaxb="http://java.sun.com/xml/ns/jaxb" 
    xsi:schemaLocation="http://www.severtrans.com severtrans.xsd"
    xmlns:xsi="http://www.w3.org/2001/XMLSchema-instance">
-->
<Shell xmlns="http://www.severtrans.com" xmlns:xsi="http://www.w3.org/2001/XMLSchema-instance" xsi:schemaLocation="http://www.severtrans.com severtrans.xsd">
    <customerID>-2758</customerID>
    <skuList>
        <sku>
            <article>string</article>
            <name>string</name>
        </sku>
        <sku>
            <article>string</article>
            <name>string</name>
        </sku>
        <sku>
            <article>string</article>
            <name>string</name>
        </sku>
    </skuList>
    <partStockRq>
        <ts>2015-03-08T18:23:56.11</ts>
    </partStockRq>
    <partStockRs>
        <ts>1987-03-07T15:49:21.13</ts>
        <line>
            <lineNumber>-4660</lineNumber>
            <article>string</article>
            <name>string</name>
            <qty>1659850.2349058</qty>
        </line>
        <line>
            <lineNumber>-3106</lineNumber>
            <article>string</article>
            <name>string</name>
            <qty>-4161979.7650942</qty>
        </line>
        <line>
            <lineNumber>-172</lineNumber>
            <article>string</article>
            <name>string</name>
            <qty>3328250.2349058</qty>
        </line>
        <line>
            <lineNumber>8</lineNumber>
            <article>string</article>
            <name>string</name>
            <qty>-1141099.7650942</qty>
        </line>
        <line>
            <lineNumber>866</lineNumber>
            <article>string</article>
            <name>string</name>
            <qty>-2265029.7650942</qty>
        </line>
    </partStockRs>
    <order>
        <orderType>Отгрузка</orderType>
        <orderNo>string</orderNo>
        <orderDate>1975-11-02T17:52:43.44</orderDate>
        <plannedDate>1979-11-21T00:02:55.34</plannedDate>
        <contrCode>string</contrCode>
        <contrName>string</contrName>
        <contrAddress>string</contrAddress>
        <licencePlate>string</licencePlate>
        <driver>string</driver>
        <comment>string</comment>
        <orderLine>
            <lineNumber>3139</lineNumber>
            <article>string</article>
            <name>string</name>
            <qty>4576870.2349058</qty>
        </orderLine>
        <orderLine>
            <lineNumber>1503</lineNumber>
            <article>string</article>
            <name>string</name>
            <qty>-1495009.7650942</qty>
        </orderLine>
        <orderLine>
            <lineNumber>1425</lineNumber>
            <article>string</article>
            <name>string</name>
            <qty>1854440.2349058</qty>
        </orderLine>
    </order>
    <pickOrder>
        <guid>string</guid>
        <orderNo>string</orderNo>
        <orderDate>2008-04-02T16:11:17.17</orderDate>
        <plannedDate>1979-04-15T02:33:06.89</plannedDate>
        <contrAddress>string</contrAddress>
        <licencePlate>string</licencePlate>
        <driver>string</driver>
        <actualArrivalTime>1999-02-25T10:43:55.14</actualArrivalTime>
        <actualDeliveryTime>1973-06-17T00:25:23.50</actualDeliveryTime>
        <pickLine>
            <lineNumber>349</lineNumber>
            <article>string</article>
            <name>string</name>
            <qty>-2298679.7650942</qty>
        </pickLine>
    </pickOrder>
    <shipmentNotif>
        <guid>string</guid>
        <orderNo>string</orderNo>
        <orderDate>1993-05-01T20:07:47.92</orderDate>
        <plannedDate>1976-09-11T01:19:15.15</plannedDate>
        <contrName>string</contrName>
        <licencePlate>string</licencePlate>
        <driver>string</driver>
        <actualArrivalTime>1987-06-01T13:05:20.88</actualArrivalTime>
        <actualDeliveryTime>2009-03-09T19:42:59.16</actualDeliveryTime>
        <orderLine>
            <lineNumber>-160</lineNumber>
            <article>string</article>
            <name>string</name>
            <qty>2633090.2349058</qty>
        </orderLine>
        <orderLine>
            <lineNumber>-3961</lineNumber>
            <article>string</article>
            <name>string</name>
            <qty>-4681949.7650942</qty>
        </orderLine>
        <orderLine>
            <lineNumber>-491</lineNumber>
            <article>string</article>
            <name>string</name>
            <qty>779690.234905804</qty>
        </orderLine>
    </shipmentNotif>
    <deliveryNotif>
        <guid>string</guid>
        <orderNo>string</orderNo>
        <orderDate>1989-03-10T01:56:40.90</orderDate>
        <plannedDate>2002-12-02T14:33:19.27</plannedDate>
        <licencePlate>string</licencePlate>
        <driver>string</driver>
        <actualArrivalTime>2007-12-17T23:41:31.27</actualArrivalTime>
        <actualDeliveryTime>1979-08-07T09:44:32.27</actualDeliveryTime>
        <orderLine>
            <lineNumber>3980</lineNumber>
            <article>string</article>
            <name>string</name>
            <qty>-1348049.7650942</qty>
        </orderLine>
        <orderLine>
            <lineNumber>1285</lineNumber>
            <article>string</article>
            <name>string</name>
            <qty>-2440229.7650942</qty>
        </orderLine>
    </deliveryNotif>
</Shell>